{
  "schema_version": "svetlost33-calendar-browser-1",
  "version": "2026.10.6",
  "revision": 4,
  "review_status": "approved",
  "approval_id": "test-only-ks01-never-publish",
  "calendar_profile_id": "spc-rs-ba-julian-v1",
  "catalog_binding": {
    "module_id": "liturgical-catalog-v1",
    "version": "2026.10.6",
    "revision": 8,
    "path": "data/liturgical-catalog-v1.json",
    "sha256": "d6a8a9df9a2ddd1596e4e1c72d3b2bdb7f26bdc0486241814543996cd7c92849"
  },
  "feast_memberships": [
    {
      "observance_id": "obs-nativity-christ",
      "occurrence_ids": [
        "occ-obs-nativity-christ-2026"
      ],
      "review_status": "reviewed",
      "source_ids": [
        "eparhija-month-01",
        "eparhija-zt-twelve-great-feasts"
      ]
    },
    {
      "observance_id": "obs-theophany",
      "occurrence_ids": [
        "occ-obs-theophany-2026"
      ],
      "review_status": "reviewed",
      "source_ids": [
        "eparhija-month-01",
        "eparhija-zt-twelve-great-feasts"
      ]
    },
    {
      "observance_id": "obs-john-baptist-synaxis",
      "occurrence_ids": [
        "occ-obs-john-baptist-synaxis-2026"
      ],
      "review_status": "reviewed",
      "source_ids": [
        "eparhija-month-01"
      ]
    },
    {
      "observance_id": "obs-sava-serbian",
      "occurrence_ids": [
        "occ-obs-sava-serbian-2026"
      ],
      "review_status": "reviewed",
      "source_ids": [
        "eparhija-month-01"
      ]
    },
    {
      "observance_id": "obs-presentation-lord",
      "occurrence_ids": [
        "occ-obs-presentation-lord-2026"
      ],
      "review_status": "reviewed",
      "source_ids": [
        "eparhija-month-02",
        "eparhija-zt-twelve-great-feasts"
      ]
    },
    {
      "observance_id": "obs-entry-jerusalem",
      "occurrence_ids": [
        "occ-obs-entry-jerusalem-2026"
      ],
      "review_status": "reviewed",
      "source_ids": [
        "eparhija-month-04",
        "eparhija-zt-twelve-great-feasts"
      ]
    },
    {
      "observance_id": "obs-annunciation",
      "occurrence_ids": [
        "occ-obs-annunciation-2026"
      ],
      "review_status": "reviewed",
      "source_ids": [
        "eparhija-month-04",
        "eparhija-zt-twelve-great-feasts"
      ]
    },
    {
      "observance_id": "obs-resurrection-christ",
      "occurrence_ids": [
        "occ-obs-resurrection-christ-2026"
      ],
      "review_status": "reviewed",
      "source_ids": [
        "eparhija-month-04",
        "eparhija-zt-twelve-great-feasts"
      ]
    },
    {
      "observance_id": "obs-george",
      "occurrence_ids": [
        "occ-obs-george-2026"
      ],
      "review_status": "reviewed",
      "source_ids": [
        "eparhija-month-05"
      ]
    },
    {
      "observance_id": "obs-ascension-lord",
      "occurrence_ids": [
        "occ-obs-ascension-lord-2026"
      ],
      "review_status": "reviewed",
      "source_ids": [
        "eparhija-month-05",
        "eparhija-zt-twelve-great-feasts"
      ]
    },
    {
      "observance_id": "obs-pentecost",
      "occurrence_ids": [
        "occ-obs-pentecost-2026"
      ],
      "review_status": "reviewed",
      "source_ids": [
        "eparhija-month-05",
        "eparhija-zt-twelve-great-feasts"
      ]
    },
    {
      "observance_id": "obs-apostles-peter-paul",
      "occurrence_ids": [
        "occ-obs-apostles-peter-paul-2026"
      ],
      "review_status": "reviewed",
      "source_ids": [
        "eparhija-month-07"
      ]
    },
    {
      "observance_id": "obs-transfiguration-lord",
      "occurrence_ids": [
        "occ-obs-transfiguration-lord-2026"
      ],
      "review_status": "reviewed",
      "source_ids": [
        "eparhija-month-08",
        "eparhija-zt-twelve-great-feasts"
      ]
    },
    {
      "observance_id": "obs-dormition-theotokos",
      "occurrence_ids": [
        "occ-obs-dormition-theotokos-2026"
      ],
      "review_status": "reviewed",
      "source_ids": [
        "eparhija-month-08",
        "eparhija-zt-twelve-great-feasts"
      ]
    },
    {
      "observance_id": "obs-nativity-theotokos",
      "occurrence_ids": [
        "occ-obs-nativity-theotokos-2026"
      ],
      "review_status": "reviewed",
      "source_ids": [
        "eparhija-month-09",
        "eparhija-zt-twelve-great-feasts"
      ]
    },
    {
      "observance_id": "obs-exaltation-cross",
      "occurrence_ids": [
        "occ-obs-exaltation-cross-2026"
      ],
      "review_status": "reviewed",
      "source_ids": [
        "eparhija-month-09",
        "eparhija-zt-twelve-great-feasts"
      ]
    },
    {
      "observance_id": "obs-paraskeva",
      "occurrence_ids": [
        "occ-obs-paraskeva-2026"
      ],
      "review_status": "reviewed",
      "source_ids": [
        "eparhija-month-10"
      ]
    },
    {
      "observance_id": "obs-demetrius",
      "occurrence_ids": [
        "occ-obs-demetrius-2026"
      ],
      "review_status": "reviewed",
      "source_ids": [
        "eparhija-month-11"
      ]
    },
    {
      "observance_id": "obs-michael-synaxis",
      "occurrence_ids": [
        "occ-obs-michael-synaxis-2026"
      ],
      "review_status": "reviewed",
      "source_ids": [
        "eparhija-month-11"
      ]
    },
    {
      "observance_id": "obs-entry-theotokos",
      "occurrence_ids": [
        "occ-obs-entry-theotokos-2026"
      ],
      "review_status": "reviewed",
      "source_ids": [
        "eparhija-month-12",
        "eparhija-zt-twelve-great-feasts"
      ]
    },
    {
      "observance_id": "obs-nicholas-december",
      "occurrence_ids": [
        "occ-obs-nicholas-december-2026"
      ],
      "review_status": "reviewed",
      "source_ids": [
        "eparhija-month-12"
      ]
    }
  ],
  "archive_start_date": "2026-09-29",
  "archive_bindings": [
    {
      "id": "calendar-week-2026-s9",
      "policy_id": "calendar-week-v1",
      "policy_version": 1,
      "library_binding": {
        "module_id": "library-annual-2026-r1",
        "version": "2026.1.1",
        "revision": 2,
        "manifest_sha256": "299a1db117028d52e63681bd688731fd9aeb2aa1ab59977c7dd0735361a9f484"
      },
      "cycles_binding": {
        "module_id": "daily-cycles-r1",
        "version": "2026.1.2",
        "revision": 3,
        "manifest_sha256": "3158c545a48956158404014fef806e649178495000ccfe18157c873e85995b20"
      }
    }
  ],
  "archive_days": [
    {
      "date": "2026-09-29",
      "binding_id": "calendar-week-2026-s9",
      "status": "available",
      "correction_id": null,
      "phases": [
        {
          "phase": "morning",
          "cycle_day_id": "general-day-2",
          "slot_id": "general-day-2-morning",
          "psalm_id": "psalm-90",
          "verse_numbers": [
            14
          ],
          "prayer_id": "our-father"
        },
        {
          "phase": "noon",
          "cycle_day_id": "general-day-2",
          "slot_id": "general-day-2-noon",
          "psalm_id": "psalm-46",
          "verse_numbers": [
            1
          ],
          "prayer_id": "publican-prayer"
        },
        {
          "phase": "evening",
          "cycle_day_id": "general-day-2",
          "slot_id": "general-day-2-evening",
          "psalm_id": "psalm-91",
          "verse_numbers": [
            1
          ],
          "prayer_id": "simeon-prayer"
        }
      ]
    },
    {
      "date": "2026-09-30",
      "binding_id": "calendar-week-2026-s9",
      "status": "available",
      "correction_id": null,
      "phases": [
        {
          "phase": "morning",
          "cycle_day_id": "general-day-3",
          "slot_id": "general-day-3-morning",
          "psalm_id": "psalm-118",
          "verse_numbers": [
            24
          ],
          "prayer_id": "trisagion"
        },
        {
          "phase": "noon",
          "cycle_day_id": "general-day-3",
          "slot_id": "general-day-3-noon",
          "psalm_id": "psalm-119",
          "verse_numbers": [
            105
          ],
          "prayer_id": "trinity-hope"
        },
        {
          "phase": "evening",
          "cycle_day_id": "general-day-3",
          "slot_id": "general-day-3-evening",
          "psalm_id": "psalm-3",
          "verse_numbers": [
            5
          ],
          "prayer_id": "guardian-angel"
        }
      ]
    },
    {
      "date": "2026-10-01",
      "binding_id": "calendar-week-2026-s9",
      "status": "available",
      "correction_id": null,
      "phases": [
        {
          "phase": "morning",
          "cycle_day_id": "general-day-4",
          "slot_id": "general-day-4-morning",
          "psalm_id": "psalm-63",
          "verse_numbers": [
            1
          ],
          "prayer_id": "theotokos-greeting"
        },
        {
          "phase": "noon",
          "cycle_day_id": "general-day-4",
          "slot_id": "general-day-4-noon",
          "psalm_id": "psalm-121",
          "verse_numbers": [
            2
          ],
          "prayer_id": "publican-prayer"
        },
        {
          "phase": "evening",
          "cycle_day_id": "general-day-4",
          "slot_id": "general-day-4-evening",
          "psalm_id": "psalm-62",
          "verse_numbers": [
            1
          ],
          "prayer_id": "bedtime-prayer"
        }
      ]
    },
    {
      "date": "2026-10-02",
      "binding_id": "calendar-week-2026-s9",
      "status": "available",
      "correction_id": null,
      "phases": [
        {
          "phase": "morning",
          "cycle_day_id": "general-day-5",
          "slot_id": "general-day-5-morning",
          "psalm_id": "psalm-92",
          "verse_numbers": [
            1,
            2
          ],
          "prayer_id": "morning-prayer"
        },
        {
          "phase": "noon",
          "cycle_day_id": "general-day-5",
          "slot_id": "general-day-5-noon",
          "psalm_id": "psalm-34",
          "verse_numbers": [
            8